{"$schema":"https://json-schema.org/draft/2020-12/schema","$id":"https://neuroai-workbench.example/schemas/entity-1.0.json","type":"object","required":["entity_id","entity_type","display_name","status","created_at","boundary"],"additionalProperties":false,"properties":{"entity_id":{"type":"string","minLength":1},"entity_type":{"enum":["ORGANIZATION","SYSTEM","MODEL","PRODUCT","TRIAL","REGULATORY_RECORD","SOURCE"]},"display_name":{"type":"string","minLength":1},"status":{"enum":["ACTIVE","SUPERSEDED","WITHDRAWN"]},"created_at":{"type":"string","minLength":1},"predecessor_entity_id":{"type":["string","null"]},"successor_entity_id":{"type":["string","null"]},"jurisdiction":{"type":["string","null"]},"notes":{"type":"string"},"boundary":{"type":"string","minLength":1}}}
